{
  "$schema": "https://json-schema.org/draft/2020-12/schema",
  "$id": "https://cadgrounded.local/schemas/cad-read-request.v1.schema.json",
  "title": "CADGrounded CADRequest read-only supertype v1",
  "description": "Candidate domain contract. command_id is the mutually-exclusive subtype discriminator.",
  "type": "object",
  "additionalProperties": false,
  "required": [
    "schema_version",
    "job_id",
    "command_id",
    "write_authority",
    "payload"
  ],
  "properties": {
    "schema_version": {
      "const": 1
    },
    "job_id": {
      "type": "string",
      "pattern": "^[A-Za-z0-9][A-Za-z0-9._-]{0,127}$"
    },
    "command_id": {
      "enum": [
        "sw.status",
        "sw.query_components",
        "sw.closest_distance_pair",
        "sw.capture_view"
      ]
    },
    "write_authority": {
      "const": "NONE"
    },
    "created_utc": {
      "type": "string",
      "format": "date-time"
    },
    "expires_utc": {
      "type": "string",
      "format": "date-time"
    },
    "source": {
      "type": "string",
      "minLength": 1,
      "maxLength": 128
    },
    "preconditions": {
      "type": "object",
      "additionalProperties": false,
      "properties": {
        "document_title_exact": {
          "type": "string",
          "minLength": 1,
          "maxLength": 512
        },
        "document_path_exact": {
          "type": "string",
          "minLength": 1,
          "maxLength": 2048
        }
      }
    },
    "payload": {
      "type": "object"
    }
  },
  "oneOf": [
    {
      "title": "StatusRequest",
      "properties": {
        "command_id": {
          "const": "sw.status"
        },
        "payload": {
          "type": "object",
          "maxProperties": 0
        }
      }
    },
    {
      "title": "ComponentQueryRequest",
      "required": [
        "preconditions"
      ],
      "properties": {
        "command_id": {
          "const": "sw.query_components"
        },
        "preconditions": {
          "required": [
            "document_title_exact"
          ]
        },
        "payload": {
          "type": "object",
          "additionalProperties": false,
          "required": [
            "top_level_only"
          ],
          "properties": {
            "top_level_only": {
              "type": "boolean"
            }
          }
        }
      }
    },
    {
      "title": "CaptureViewRequest",
      "required": ["preconditions"],
      "properties": {
        "command_id": { "const": "sw.capture_view" },
        "preconditions": { "required": ["document_title_exact", "document_path_exact"] },
        "payload": {
          "type": "object",
          "additionalProperties": false,
          "required": ["active_configuration_exact"],
          "properties": {
            "active_configuration_exact": { "type": "string", "minLength": 1, "maxLength": 512 },
            "orientation_rotation9": { "type": "array", "minItems": 9, "maxItems": 9, "items": { "type": "number" } },
            "translation3_m": { "type": "array", "minItems": 3, "maxItems": 3, "items": { "type": "number" } },
            "scale2": { "type": "number", "exclusiveMinimum": 0, "maximum": 1000000000 }
          }
        }
      }
    },
    {
      "title": "ClosestDistanceRequest",
      "required": [
        "preconditions"
      ],
      "properties": {
        "command_id": {
          "const": "sw.closest_distance_pair"
        },
        "preconditions": {
          "required": [
            "document_title_exact"
          ]
        },
        "payload": {
          "type": "object",
          "additionalProperties": false,
          "required": [
            "a_name_exact",
            "b_name_exact"
          ],
          "properties": {
            "a_name_exact": {
              "type": "string",
              "minLength": 1,
              "maxLength": 1024
            },
            "b_name_exact": {
              "type": "string",
              "minLength": 1,
              "maxLength": 1024
            }
          }
        }
      }
    }
  ]
}
