{
  "schema_version": 1,
  "job_id": "v42-preflight-b1-stop1-20260917-b",
  "command_id": "sw.closest_distance_pair",
  "write_authority": "NONE",
  "source": "ChatGPT-v42-orchestration-evidence",
  "preconditions": {
    "document_title_exact": "IXOR_Benchmark_v42_ROLLER_GUIDE_HARDSTOP_FIT_CHECK_PORTABLE",
    "document_path_exact": "C:\\ChatGPT\\Solidworks\\IXOR\\CAB_IXOR_6130800\\IXOR_Benchmark_v42_ROLLER_GUIDE_HARDSTOP_FIT_CHECK_PORTABLE.SLDASM"
  },
  "payload": {
    "a_name_exact": "FITCHECK_INDEX_STOP_FINGER_54p25x6x20_V37-1",
    "b_name_exact": "BENCH_BOTTLE_D48_H180-1"
  }
}