{
  "schema_version": 1,
  "job_id": "v42-distance-ar60-carriage-20260917t1540z",
  "command_id": "sw.closest_distance_pair",
  "write_authority": "NONE",
  "created_utc": "2026-09-17T15:40:00Z",
  "expires_utc": "2026-09-17T16:20:00Z",
  "source": "cadgrounded_v42_readonly_preflight",
  "preconditions": {
    "document_title_exact": "IXOR_Benchmark_v42_ROLLER_GUIDE_HARDSTOP_FIT_CHECK_PORTABLE",
    "document_path_exact": "C:\\ChatGPT\\Solidworks\\IXOR\\CAB_IXOR_6130800\\IXOR_Benchmark_v42_ROLLER_GUIDE_HARDSTOP_FIT_CHECK_PORTABLE.SLDASM"
  },
  "payload": {
    "a_name_exact": "6130460_03_AR60_NATIVE_PORTABLE_V18-2",
    "b_name_exact": "6130649_01_Carriage_Schlitten_AR_NATIVE_PORTABLE_V20-1"
  }
}
